{
  "schema_version": 1,
  "event_id": "7f6c2a90-4b13-4b68-9d21-67283e0c5f44:usage",
  "event_type": "usage_observed",
  "logical_request_id": "7f6c2a90-4b13-4b68-9d21-67283e0c5f44",
  "x_request_id": "b3e1fba5-16a4-4dfb-aa84-50141e80d473",
  "observation_id": "7f6c2a90-4b13-4b68-9d21-67283e0c5f44",
  "observation_scope": "gateway_response",
  "producer_id": "observer-pod-uid",
  "gateway_instance_id": "gateway-pod-uid",
  "config_version": "collection-v1",
  "adapter_id": "chat_completions_v1",
  "route_name": "llm-chat",
  "request_host": "model.example.invalid",
  "cluster_name": "fixture-cluster",
  "deployment_environment": "stg",
  "service_id": "model-service-a",
  "provider_id": "provider-a",
  "mapping_version": "e475bfa24c9f16841c8cb11f66586faf008e144eddc1fa7ff3595bae6999905b",
  "mapping_status": "mapped",
  "api_key_id": "key-42",
  "customer_id": "customer-7",
  "customer_mapping_version": "1713a45606930ab59d794cd8ddd92eff6ce2df588201f4df1ec8bf5354748081",
  "customer_mapping_status": "mapped",
  "identity_status": "known",
  "request_started_at_ms": 1789862400000,
  "observation_ended_at_ms": 1789862401200,
  "request_finished_at_ms": null,
  "event_created_at_ms": 1789862401201,
  "request_model": "model-a",
  "response_model": "model-a-2026",
  "http_status": 200,
  "upstream_attempt_count": null,
  "response_flags": null,
  "response_code_details": null,
  "business_outcome": "unknown",
  "terminal_observed": false,
  "observation_status": "partial",
  "usage_status": "unknown",
  "usage_eligible": false,
  "usage": {
    "input_tokens": {
      "value": null,
      "source": "unknown"
    },
    "output_tokens": {
      "value": null,
      "source": "unknown"
    },
    "cached_read_tokens": {
      "value": null,
      "source": "unknown"
    },
    "cached_write_tokens": {
      "value": null,
      "source": "unknown"
    },
    "reasoning_tokens": {
      "value": null,
      "source": "unknown"
    },
    "reported_total_tokens": {
      "value": null,
      "source": "unknown"
    }
  },
  "raw_usage_json": "{}",
  "raw_usage_truncated": false,
  "anomaly_codes": [
    "missing_end",
    "missing_usage",
    "transport_lost"
  ],
  "service_name": "模型服务 A",
  "provider_name": "供应商 A",
  "customer_name": "客户 A"
}
